{
  "version": 1,
  "agentCount": 19,
  "piHarnessRootHint": "modules/agents/pi",
  "agents": [
    {
      "name": "project-init",
      "piSource": "modules/agents/pi/agents/project-init.md",
      "ompDestination": "omp/agents/project-init.md",
      "phase": "init",
      "purpose": "Stack-aware project scaffold \u2014 AGENTS.md tree, CLAUDE.md symlinks, bd init, stack skill checklist. No full harness.",
      "inputs": [
        "harness-context",
        "bd-issue-or-spec"
      ],
      "outputs": [
        "structured-report-or-json"
      ],
      "writeScope": "harness-artifacts",
      "allowedTools": [
        "bash",
        "read",
        "search",
        "edit",
        "write"
      ],
      "forbiddenActions": [
        "broaden-write-scope",
        "copy-superpowers-bodies",
        "skip-bd"
      ],
      "requiredSuperpowers": [],
      "requiredStackSkills": [],
      "outputSchema": "omp/schemas/project-init.output.schema.json",
      "modelRoute": "sol",
      "reasoningEffort": "high",
      "worktreeResponsibility": "none",
      "reviewResponsibility": "author",
      "piBaseline": {
        "frontmatterName": "project-init",
        "description": "Stack-aware project scaffold \u2014 AGENTS.md tree, CLAUDE.md symlinks, bd init, stack skill checklist. No full harness.",
        "bodySha256": "9e19a962c03429766a7f664826925b68eec232083e9e367378fb1fa28456d5d7"
      },
      "ompNativeDeltas": [
        "strict-output-schemas",
        "fail-closed-post-validation",
        "narrower-tools-write-scopes",
        "corrected-superpowers-ownership",
        "direct-live-skill-md-loading",
        "omp-native-hashline-lsp-ast-search-web-task",
        "real-harness-managed-worktrees",
        "bundled-omp-scout-reviewer-librarian-strengths",
        "beads-broker-ownership"
      ]
    },
    {
      "name": "spec-writer",
      "piSource": "modules/agents/pi/agents/spec-writer.md",
      "ompDestination": "omp/agents/spec-writer.md",
      "phase": "spec",
      "purpose": "Brainstorm and write design/spec from goal + research. Producer for Spec gate. Use brainstorming skill.",
      "inputs": [
        "harness-context",
        "bd-issue-or-spec"
      ],
      "outputs": [
        "structured-report-or-json"
      ],
      "writeScope": "harness-artifacts",
      "allowedTools": [
        "bash",
        "read",
        "search",
        "edit",
        "write",
        "web_search"
      ],
      "forbiddenActions": [
        "broaden-write-scope",
        "copy-superpowers-bodies",
        "skip-bd"
      ],
      "requiredSuperpowers": [
        "brainstorming",
        "writing-plans"
      ],
      "requiredStackSkills": [],
      "outputSchema": "omp/schemas/spec-writer.output.schema.json",
      "modelRoute": "fabel+sol",
      "reasoningEffort": "ultra",
      "worktreeResponsibility": "none",
      "reviewResponsibility": "author",
      "piBaseline": {
        "frontmatterName": "spec-writer",
        "description": "Brainstorm and write design/spec from goal + research. Producer for Spec gate. Use brainstorming skill.",
        "bodySha256": "5a17cdf1bd9124b5d8afcbb586c9784e0651c0a89361f40e5b654c2406f4d3ba"
      },
      "ompNativeDeltas": [
        "strict-output-schemas",
        "fail-closed-post-validation",
        "narrower-tools-write-scopes",
        "corrected-superpowers-ownership",
        "direct-live-skill-md-loading",
        "omp-native-hashline-lsp-ast-search-web-task",
        "real-harness-managed-worktrees",
        "bundled-omp-scout-reviewer-librarian-strengths",
        "beads-broker-ownership"
      ]
    },
    {
      "name": "spec-reviewer",
      "piSource": "modules/agents/pi/agents/spec-reviewer.md",
      "ompDestination": "omp/agents/spec-reviewer.md",
      "phase": "spec",
      "purpose": "Adversarial review of design/spec. Returns JSON only. Different agent from spec-writer.",
      "inputs": [
        "harness-context",
        "bd-issue-or-spec"
      ],
      "outputs": [
        "structured-report-or-json"
      ],
      "writeScope": "none",
      "allowedTools": [
        "bash",
        "read",
        "search"
      ],
      "forbiddenActions": [
        "broaden-write-scope",
        "copy-superpowers-bodies",
        "skip-bd"
      ],
      "requiredSuperpowers": [
        "requesting-code-review"
      ],
      "requiredStackSkills": [],
      "outputSchema": "omp/schemas/spec-reviewer.output.schema.json",
      "modelRoute": "fabel|sol",
      "reasoningEffort": "ultra",
      "worktreeResponsibility": "none",
      "reviewResponsibility": "gate",
      "piBaseline": {
        "frontmatterName": "spec-reviewer",
        "description": "Adversarial review of design/spec. Returns JSON only. Different agent from spec-writer.",
        "bodySha256": "42a446eb4c0fef03c3522c3c9d1ebc18bc430e329b123ea033b1fb6217e823f7"
      },
      "ompNativeDeltas": [
        "strict-output-schemas",
        "fail-closed-post-validation",
        "narrower-tools-write-scopes",
        "corrected-superpowers-ownership",
        "direct-live-skill-md-loading",
        "omp-native-hashline-lsp-ast-search-web-task",
        "real-harness-managed-worktrees",
        "bundled-omp-scout-reviewer-librarian-strengths",
        "beads-broker-ownership"
      ]
    },
    {
      "name": "plan-writer",
      "piSource": "modules/agents/pi/agents/plan-writer.md",
      "ompDestination": "omp/agents/plan-writer.md",
      "phase": "plan",
      "purpose": "Write incremental implementation plan from approved spec. Producer for Plan gate. Use writing-plans skill.",
      "inputs": [
        "harness-context",
        "bd-issue-or-spec"
      ],
      "outputs": [
        "structured-report-or-json"
      ],
      "writeScope": "harness-artifacts",
      "allowedTools": [
        "bash",
        "read",
        "search",
        "edit",
        "write",
        "web_search"
      ],
      "forbiddenActions": [
        "broaden-write-scope",
        "copy-superpowers-bodies",
        "skip-bd"
      ],
      "requiredSuperpowers": [
        "writing-plans"
      ],
      "requiredStackSkills": [],
      "outputSchema": "omp/schemas/plan-writer.output.schema.json",
      "modelRoute": "fabel+sol",
      "reasoningEffort": "ultra",
      "worktreeResponsibility": "none",
      "reviewResponsibility": "author",
      "piBaseline": {
        "frontmatterName": "plan-writer",
        "description": "Write incremental implementation plan from approved spec. Producer for Plan gate. Use writing-plans skill.",
        "bodySha256": "edea0911cfae1306c24206d4061980d52e820429718146115a54f38539c0018d"
      },
      "ompNativeDeltas": [
        "strict-output-schemas",
        "fail-closed-post-validation",
        "narrower-tools-write-scopes",
        "corrected-superpowers-ownership",
        "direct-live-skill-md-loading",
        "omp-native-hashline-lsp-ast-search-web-task",
        "real-harness-managed-worktrees",
        "bundled-omp-scout-reviewer-librarian-strengths",
        "beads-broker-ownership"
      ]
    },
    {
      "name": "plan-reviewer",
      "piSource": "modules/agents/pi/agents/plan-reviewer.md",
      "ompDestination": "omp/agents/plan-reviewer.md",
      "phase": "plan",
      "purpose": "Review implementation plan for ordering, size, risks, testability. JSON only.",
      "inputs": [
        "harness-context",
        "bd-issue-or-spec"
      ],
      "outputs": [
        "structured-report-or-json"
      ],
      "writeScope": "none",
      "allowedTools": [
        "bash",
        "read",
        "search"
      ],
      "forbiddenActions": [
        "broaden-write-scope",
        "copy-superpowers-bodies",
        "skip-bd"
      ],
      "requiredSuperpowers": [
        "requesting-code-review"
      ],
      "requiredStackSkills": [],
      "outputSchema": "omp/schemas/plan-reviewer.output.schema.json",
      "modelRoute": "fabel|sol",
      "reasoningEffort": "ultra",
      "worktreeResponsibility": "none",
      "reviewResponsibility": "gate",
      "piBaseline": {
        "frontmatterName": "plan-reviewer",
        "description": "Review implementation plan for ordering, size, risks, testability. JSON only.",
        "bodySha256": "6e4d224d287762be7ac8f430f94fbd02df221abec04593c0dde1993aadb96c7b"
      },
      "ompNativeDeltas": [
        "strict-output-schemas",
        "fail-closed-post-validation",
        "narrower-tools-write-scopes",
        "corrected-superpowers-ownership",
        "direct-live-skill-md-loading",
        "omp-native-hashline-lsp-ast-search-web-task",
        "real-harness-managed-worktrees",
        "bundled-omp-scout-reviewer-librarian-strengths",
        "beads-broker-ownership"
      ]
    },
    {
      "name": "bite-size-writer",
      "piSource": "modules/agents/pi/agents/bite-size-writer.md",
      "ompDestination": "omp/agents/bite-size-writer.md",
      "phase": "bitesize",
      "purpose": "Split plan tasks until each is implementable in one focused worktree pass.",
      "inputs": [
        "harness-context",
        "bd-issue-or-spec"
      ],
      "outputs": [
        "structured-report-or-json"
      ],
      "writeScope": "harness-artifacts",
      "allowedTools": [
        "bash",
        "read",
        "search",
        "edit",
        "write"
      ],
      "forbiddenActions": [
        "broaden-write-scope",
        "copy-superpowers-bodies",
        "skip-bd"
      ],
      "requiredSuperpowers": [
        "writing-plans"
      ],
      "requiredStackSkills": [],
      "outputSchema": "omp/schemas/bite-size-writer.output.schema.json",
      "modelRoute": "sol",
      "reasoningEffort": "high",
      "worktreeResponsibility": "none",
      "reviewResponsibility": "author",
      "piBaseline": {
        "frontmatterName": "bite-size-writer",
        "description": "Split plan tasks until each is implementable in one focused worktree pass.",